l0=0002 l1=001 l2=Eleg l8=1 l9=t	ΕΛΕΓΕΙΩΝ Α Ὦ ἄνα, Λητοῦσ υἱέ, Διὸσ τέκοσ, οὔποτε σεῖο λήσομαι ἀρχόμενοσ οὐδ’ ἀποπαυόμενοσ, ἀλλ’ αἰεὶ πρῶτόν τε καὶ ὕστατον ἔν τε μέσοισιν ἀείσω· σὺ δέ μοι κλῦθι καὶ ἐσθλὰ δίδου.
l0=0002 l1=001 l2=Eleg l8=1 l9=4	Φοῖβε ἄναξ, ὅτε μέν σε θεὰ τέκε πότνια Λητώ φοίνικοσ ῥαδινῆισ χερσὶν ἐφαψαμένη ἀθανάτων κάλλιστον ἐπὶ τροχοειδέι λίμνηι, πᾶσα μὲν ἐπλήσθη Δῆλοσ ἀπειρεσίη ὀδμῆσ ἀμβροσίησ, ἐγέλασσε δὲ Γαῖα πελώρη, γήθησεν δὲ βαθὺσ πόντοσ ἁλὸσ πολιῆσ.
l0=0002 l1=001 l2=Eleg l8=1 l9=10	Ἄρτεμι θηροφόνη, θύγατερ Διόσ, ἣν Ἀγαμέμνων εἵσαθ’, ὅτ’ ἐσ Τροίην ἔπλεε νηυσὶ θοῆισ, εὐχομένωι μοι κλῦθι, κακὰσ δ’ ἀπὸ κῆρασ ἄλαλκε· σοὶ μὲν τοῦτο, θεά, σμικρόν, ἐμοὶ δὲ μέγα.
l0=0002 l1=001 l2=Eleg l8=1 l9=14	Μοῦσαι καὶ Χάριτεσ, κοῦραι Διόσ, αἵ ποτε Κάδμου ἐσ γάμον ἐλθοῦσαι καλὸν ἀείσατ’ ἔποσ, ‘ὅττι καλόν, φίλον ἐστί· τὸ δ’ οὐ καλὸν οὐ φίλον ἐστί,’ τοῦτ’ ἔποσ ἀθανάτων ἦλθε διὰ στομάτων.
l0=0002 l1=001 l2=Eleg l8=1 l9=18	Κύρνε, σοφιζομένωι μὲν ἐμοὶ σφρηγὶσ ἐπικείσθω τοῖσδ’ ἔπεσιν, λήσει δ’ οὔποτε κλεπτόμενα, οὐδέ τισ ἀλλάξει κάκιον τοὐσθλοῦ παρεόντοσ· ὧδε δὲ πᾶσ τισ ἐρεῖ· ’Θεύγνιδόσ ἐστιν ἔπη τοῦ Μεγαρέωσ· πάντασ δὲ κατ’ ἀνθρώπουσ ὀνομαστόσ.’
l0=0002 l1=001 l2=Eleg l8=1 l9=23	ἀστοῖσιν δ’ οὔπω πᾶσιν ἁδεῖν δύναμαι· οὐδὲν θαυμαστόν, Πολυπαί̈δη· οὐδὲ γὰρ ὁ Ζεύσ οὔθ’ ὕων πάντεσσ’ ἁνδάνει οὔτ’ ἀνέχων.
l0=0002 l1=001 l2=Eleg l8=1 l9=26	Σοὶ δ’ ἐγὼ εὖ φρονέων ὑποθήσομαι, οἷά περ αὐτόσ, Κύρν’, ἀπὸ τῶν ἀγαθῶν παῖσ ἔτ’ ἐὼν ἔμαθον· πέπνυσο, μηδ’ αἰσχροῖσιν ἐπ’ ἔργμασι μηδ’ ἀδίκοισιν τιμὰσ μηδ’ ἀρετὰσ ἕλκεο μηδ’ ἄφενοσ.
l0=0002 l1=001 l2=Eleg l8=1 l9=30	ταῦτα μὲν οὕτωσ ἴσθι· κακοῖσι δὲ μὴ προσομίλει ἀνδράσιν, ἀλλ’ αἰεὶ τῶν ἀγαθῶν ἔχεο· καὶ μετὰ τοῖσιν πῖνε καὶ ἔσθιε, καὶ μετὰ τοῖσιν ἵζε, καὶ ἅνδανε τοῖσ’, ὧν μεγάλη δύναμισ.
l0=0002 l1=001 l2=Eleg l8=1 l9=34	ἐσθλῶν μὲν γὰρ ἄπ’ ἐσθλὰ μαθήσεαι· ἢν δὲ κακοῖσιν συμμίσγηισ, ἀπολεῖσ καὶ τὸν ἐόντα νόον.
l0=0002 l1=001 l2=Eleg l8=1 l9=36	ταῦτα μαθὼν ἀγαθοῖσιν ὁμίλεε, καί ποτε φήσεισ εὖ συμβουλεύειν τοῖσι φίλοισιν ἐμέ.
l0=0002 l1=001 l2=Eleg l8=1 l9=38	Κύρνε, κύει πόλισ ἥδε, δέδοικα δὲ μὴ τέκηι ἄνδρα εὐθυντῆρα κακῆσ ὕβριοσ ἡμετέρησ.
l0=0002 l1=001 l2=Eleg l8=1 l9=40	ἀστοὶ μὲν γὰρ ἔθ’ οἵδε σαόφρονεσ, ἡγεμόνεσ δέ τετράφαται πολλὴν εἰσ κακότητα πεσεῖν.
l0=0002 l1=001 l2=Eleg l8=1 l9=42	οὐδεμίαν πω, Κύρν’, ἀγαθοὶ πόλιν ὤλεσαν ἄνδρεσ, ἀλλ’ ὅταν ὑβρίζειν τοῖσι κακοῖσιν ἅδηι δῆμόν τε φθείρουσι δίκασ τ’ ἀδίκοισι διδοῦσιν οἰκείων κερδέων εἵνεκα καὶ κράτεοσ· ἔλπεο μὴ δηρὸν κείνην πόλιν ἀτρεμέ’ ἧσθαι, μηδ’ εἰ νῦν κεῖται πολλῆι ἐν ἡσυχίηι, εὖτ’ ἂν τοῖσι κακοῖσι φίλ’ ἀνδράσι ταῦτα γένηται, κέρδεα δημοσίωι σὺν κακῶι ἐρχόμενα.
l0=0002 l1=001 l2=Eleg l8=1 l9=50	ἐκ τῶν γὰρ στάσιέσ τε καὶ ἔμφυλοι φόνοι ἀνδρῶν· μούναρχοι δὲ πόλει μήποτε τῆιδε ἅδοι.
l0=0002 l1=001 l2=Eleg l8=1 l9=52	Κύρνε, πόλισ μὲν ἔθ’ ἥδε πόλισ, λαοὶ δὲ δὴ ἄλλοι, οἳ πρόσθ’ οὔτε δίκασ ἤιδεσαν οὔτε νόμουσ, ἀλλ’ ἀμφὶ πλευραῖσι δορὰσ αἰγῶν κατέτριβον, ἔξω δ’ ὥστ’ ἔλαφοι τῆσδ’ ἐνέμοντο πόλεοσ.
l0=0002 l1=001 l2=Eleg l8=1 l9=56	καὶ νῦν εἰσ’ ἀγαθοί, Πολυπαί̈δη· οἱ δὲ πρὶν ἐσθλοί νῦν δειλοί.
l0=0002 l1=001 l2=Eleg l8=1 l9=58	τίσ κεν ταῦτ’ ἀνέχοιτ’ ἐσορῶν;
l0=0002 l1=001 l2=Eleg l8=1 l9=58	ἀλλήλουσ δ’ ἀπατῶσιν ἐπ’ ἀλλήλοισι γελῶντεσ, οὔτε κακῶν γνώμασ εἰδότεσ οὔτ’ ἀγαθῶν.
l0=0002 l1=001 l2=Eleg l8=1 l9=60	μηδένα τῶνδε φίλον ποιεῦ, Πολυπαί̈δη, ἀστῶν ἐκ θυμοῦ χρείησ οὕνεκα μηδεμιῆσ· ἀλλὰ δόκει μὲν πᾶσιν ἀπὸ γλώσσησ φίλοσ εἶναι, χρῆμα δὲ συμμείξηισ μηδενὶ μηδ’ ὁτιοῦν σπουδαῖον· γνώσηι γὰρ ὀιζυρῶν φρένασ ἀνδρῶν, ὥσ σφιν ἐπ’ ἔργοισιν πίστισ ἔπ’ οὐδεμία, ἀλλὰ δόλουσ ἀπάτασ τε πολυπλοκίασ τ’ ἐφίλησαν οὕτωσ ὡσ ἄνδρεσ μηκέτι σωιζόμενοι.
l0=0002 l1=001 l2=Eleg l8=1 l9=68	Μήποτε, Κύρνε, κακῶι πίσυνοσ βούλευε σὺν ἀνδρί, εὖτ’ ἂν σπουδαῖον πρῆγμ’ ἐθέληισ τελέσαι, ἀλλὰ μετ’ ἐσθλὸν ἰὼν βούλευ καὶ πολλὰ μογῆσαι καὶ μακρὴν ποσσίν, Κύρν’, ὁδὸν ἐκτελέσαι.
l0=0002 l1=001 l2=Eleg l8=1 l9=72	Πρῆξιν μηδὲ φίλοισιν ὅλωσ ἀνακοινέο πᾶσιν· παῦροί τοι πολλῶν πιστὸν ἔχουσι νόον.
l0=0002 l1=001 l2=Eleg l8=1 l9=74	Παύροισιν πίσυνοσ μεγάλ’ ἀνδράσιν ἔργ’ ἐπιχείρει, μή ποτ’ ἀνήκεστον, Κύρνε, λάβηισ ἀνίην.
l0=0002 l1=001 l2=Eleg l8=1 l9=76	Πιστὸσ ἀνὴρ χρυσοῦ τε καὶ ἀργύρου ἀντερύσασθαι ἄξιοσ ἐν χαλεπῆι, Κύρνε, διχοστασίηι.
l0=0002 l1=001 l2=Eleg l8=1 l9=78	Παύρουσ εὑρήσεισ, Πολυπαί̈δη, ἄνδρασ ἑταίρουσ πιστοὺσ ἐν χαλεποῖσ πρήγμασι γινομένουσ, οἵτινεσ ἂν τολμῶιεν ὁμόφρονα θυμὸν ἔχοντεσ ἶσον τῶν ἀγαθῶν τῶν τε κακῶν μετέχειν.
l0=0002 l1=001 l2=Eleg l8=1 l9=82	Τούτουσ οὔ χ’ εὕροισ διζήμενοσ οὐδ’ ἐπὶ πάντασ ἀνθρώπουσ, οὓσ ναῦσ μὴ μία πάντασ ἄγοι, οἷσιν ἐπὶ γλώσσηι τε καὶ ὀφθαλμοῖσιν ἔπεστιν αἰδώσ, οὐδ’ αἰσχρὸν χρῆμ’ ἔπι κέρδοσ ἄγει.
l0=0002 l1=001 l2=Eleg l8=1 l9=86	Μή μ’ ἔπεσιν μὲν στέργε, νόον δ’ ἔχε καὶ φρένασ ἄλληι, εἴ με φιλεῖσ καί σοι πιστὸσ ἔνεστι νόοσ.
l0=0002 l1=001 l2=Eleg l8=1 l9=88	ἤ με φίλει καθαρὸν θέμενοσ νόον, ἤ μ’ ἀποειπών ἔχθαιρ’ ἀμφαδίην νεῖκοσ ἀειράμενοσ.
l0=0002 l1=001 l2=Eleg l8=1 l9=90	ὃσ δὲ μιῆι γλώσσηι δίχ’ ἔχει νόον, οὗτοσ ἑταῖροσ δεινόσ, Κύρν’, ἐχθρὸσ βέλτεροσ ἢ φίλοσ ὤν.
l0=0002 l1=001 l2=Eleg l8=1 l9=92	Ἄν τισ ἐπαινήσηι σε τόσον χρόνον ὅσσον ὁρώιησ, νοσφισθεὶσ δ’ ἄλλην γλῶσσαν ἱῆισι κακήν, τοιοῦτόσ τοι ἑταῖροσ ἀνὴρ φίλοσ οὔ τι μάλ’ ἐσθλόσ, ὅσ κ’ εἴπηι γλώσσηι λῶια, φρονῆι δ’ ἕτερα.
l0=0002 l1=001 l2=Eleg l8=1 l9=96	ἀλλ’ εἴη τοιοῦτοσ ἐμοὶ φίλοσ, ὃσ τὸν ἑταῖρον γινώσκων ὀργὴν καὶ βαρὺν ὄντα φέρει ἀντὶ κασιγνήτου.
l0=0002 l1=001 l2=Eleg l8=1 l9=99	σὺ δέ μοι, φίλε, ταῦτ’ ἐνὶ θυμῶι φράζεο, καί ποτέ μου μνήσεαι ἐξοπίσω.
l0=0002 l1=001 l2=Eleg l8=1 l9=100	Μηδείσ σ’ ἀνθρώπων πείσηι κακὸν ἄνδρα φιλῆσαι, Κύρνε· τί δ’ ἔστ’ ὄφελοσ δειλὸσ ἀνὴρ φίλοσ ὤν;
l0=0002 l1=001 l2=Eleg l8=1 l9=102	οὔτ’ ἄν σ’ ἐκ χαλεποῖο πόνου ῥύσαιτο καὶ ἄτησ, οὔτε κεν ἐσθλὸν ἔχων τοῦ μεταδοῦν ἐθέλοι.
l0=0002 l1=001 l2=Eleg l8=1 l9=104	Δειλοὺσ εὖ ἕρδοντι ματαιοτάτη χάρισ ἐστίν· ἶσον καὶ σπείρειν πόντον ἁλὸσ πολιῆσ.
l0=0002 l1=001 l2=Eleg l8=1 l9=106	οὔτε γὰρ ἂν πόντον σπείρων βαθὺ λήιον ἀμῶισ, οὔτε κακοὺσ εὖ δρῶν εὖ πάλιν ἀντιλάβοισ· ἄπληστον γὰρ ἔχουσι κακοὶ νόον· ἢν δ’ ἓν ἁμάρτηισ, τῶν πρόσθεν πάντων ἐκκέχυται φιλότησ· οἱ δ’ ἀγαθοὶ τὸ μέγιστον ἐπαυρίσκουσι παθόντεσ, μνῆμα δ’ ἔχουσ’ ἀγαθῶν καὶ χάριν ἐξοπίσω.
l0=0002 l1=001 l2=Eleg l8=1 l9=112	Μήποτε τὸν κακὸν ἄνδρα φίλον ποιεῖσθαι ἑταῖρον, ἀλλ’ αἰεὶ φεύγειν ὥστε κακὸν λιμένα.
l0=0002 l1=001 l2=Eleg l8=1 l9=114	Πολλοί τοι πόσιοσ καὶ βρώσιόσ εἰσιν ἑταῖροι, ἐν δὲ σπουδαίωι πρήγματι παυρότεροι.
l0=0002 l1=001 l2=Eleg l8=1 l9=116	Κιβδήλου δ’ ἀνδρὸσ γνῶναι χαλεπώτερον οὐδέν, Κύρν’, οὐδ’ εὐλαβίησ ἐστὶ περὶ πλέονοσ.
l0=0002 l1=001 l2=Eleg l8=1 l9=118	Χρυσοῦ κιβδήλοιο καὶ ἀργύρου ἀνσχετὸσ ἄτη, Κύρνε, καὶ ἐξευρεῖν ῥάιδιον ἀνδρὶ σοφῶι.
l0=0002 l1=001 l2=Eleg l8=1 l9=120	εἰ δὲ φίλου νόοσ ἀνδρὸσ ἐνὶ στήθεσσι λελήθηι ψυδρὸσ ἐών, δόλιον δ’ ἐν φρεσὶν ἦτορ ἔχηι, τοῦτο θεὸσ κιβδηλότατον ποίησε βροτοῖσιν, καὶ γνῶναι πάντων τοῦτ’ ἀνιηρότατον.
l0=0002 l1=001 l2=Eleg l8=1 l9=124	οὐδὲ γὰρ εἰδείησ ἀνδρὸσ νόον οὐδὲ γυναικόσ, πρὶν πειρηθείησ ὥσπερ ὑποζυγίου, οὐδέ κεν εἰκάσσαισ ὥσπερ ποτ’ ἐσ ὥριον ἐλθών· πολλάκι γὰρ γνώμην ἐξαπατῶσ’ ἰδέαι.
l0=0002 l1=001 l2=Eleg l8=1 l9=128	Μήτ’ ἀρετὴν εὔχου, Πολυπαί̈δη, ἔξοχοσ εἶναι μήτ’ ἄφενοσ· μοῦνον δ’ ἀνδρὶ γένοιτο τύχη.
l0=0002 l1=001 l2=Eleg l8=1 l9=130	Οὐδὲν ἐν ἀνθρώποισι πατρὸσ καὶ μητρὸσ ἄμεινον ἔπλετο, οἷσ’ ὁσίη, Κύρνε, μέμηλε δίκη.
l0=0002 l1=001 l2=Eleg l8=1 l9=132	Οὐδείσ, Κύρν’, ἄτησ καὶ κέρδεοσ αἴτιοσ αὐτόσ, ἀλλὰ θεοὶ τούτων δώτορεσ ἀμφοτέρων· οὐδέ τισ ἀνθρώπων ἐργάζεται ἐν φρεσὶν εἰδώσ, ἐσ τέλοσ εἴτ’ ἀγαθὸν γίνεται εἴτε κακόν.
l0=0002 l1=001 l2=Eleg l8=1 l9=136	πολλάκι γὰρ δοκέων θήσειν κακὸν ἐσθλὸν ἔθηκεν, καί τε δοκῶν θήσειν ἐσθλὸν ἔθηκε κακόν.
l0=0002 l1=001 l2=Eleg l8=1 l9=138	οὐδέ τωι ἀνθρώπων παραγίνεται, ὅσσα θέληισιν· ἴσχει γὰρ χαλεπῆσ πείρατ’ ἀμηχανίησ.
l0=0002 l1=001 l2=Eleg l8=1 l9=140	ἄνθρωποι δὲ μάταια νομίζομεν εἰδότεσ οὐδέν· θεοὶ δὲ κατὰ σφέτερον πάντα τελοῦσι νόον.
l0=0002 l1=001 l2=Eleg l8=1 l9=142	Οὐδείσ πω ξεῖνον, Πολυπαί̈δη, ἐξαπατήσασ οὐδ’ ἱκέτην θνητῶν ἀθανάτουσ ἔλαθεν.
l0=0002 l1=001 l2=Eleg l8=1 l9=144	Βούλεο δ’ εὐσεβέων ὀλίγοισ σὺν χρήμασιν οἰκεῖν ἢ πλουτεῖν ἀδίκωσ χρήματα πασάμενοσ.
l0=0002 l1=001 l2=Eleg l8=1 l9=146	ἐν δὲ δικαιοσύνηι συλλήβδην πᾶσ’ ἀρετή ’στι, πᾶσ δέ τ’ ἀνὴρ ἀγαθόσ, Κύρνε, δίκαιοσ ἐών.
l0=0002 l1=001 l2=Eleg l8=1 l9=148	Χρήματα μὲν δαίμων καὶ παγκάκωι ἀνδρὶ δίδωσιν, Κύρν’· ἀρετῆσ δ’ ὀλίγοισ’ ἀνδράσι μοῖρ’ ἕπεται.
l0=0002 l1=001 l2=Eleg l8=1 l9=150	Ὕβριν, Κύρνε, θεὸσ πρῶτον κακῶι ὤπασεν ἀνδρί, οὗ μέλλει χώρην μηδεμίην θέμεναι.
l0=0002 l1=001 l2=Eleg l8=1 l9=152	Τίκτει τοι κόροσ ὕβριν, ὅταν κακῶι ὄλβοσ ἕπηται ἀνθρώπωι καὶ ὅτωι μὴ νόοσ ἄρτιοσ ἦι.
l0=0002 l1=001 l2=Eleg l8=1 l9=154	Μήποτέ τοι πενίην θυμοφθόρον ἀνδρὶ χολωθείσ μηδ’ ἀχρημοσύνην οὐλομένην πρόφερε· Ζεὺσ γάρ τοι τὸ τάλαντον ἐπιρρέπει ἄλλοτε ἄλλωι, ἄλλοτε μὲν πλουτεῖν, ἄλλοτε μηδὲν ἔχειν.
l0=0002 l1=001 l2=Eleg l8=1 l9=158	Μήποτε, Κύρν’, ἀγορᾶσθαι ἔποσ μέγα· οἶδε γὰρ οὐδείσ ἀνθρώπων ὅ τι νὺξ χἠμέρη ἀνδρὶ τελεῖ.
l0=0002 l1=001 l2=Eleg l8=1 l9=160	Πολλοί τοι χρῶνται δειλαῖσ φρεσί, δαίμονι δ’ ἐσθλῶι, οἷσ τὸ κακὸν δοκέον γίνεται εἰσ ἀγαθόν.
l0=0002 l1=001 l2=Eleg l8=1 l9=162	εἰσὶν δ’ οἳ βουλῆι τ’ ἀγαθῆι καὶ δαίμονι δειλῶι μοχθίζουσι, τέλοσ δ’ ἔργμασιν οὐχ ἕπεται.
l0=0002 l1=001 l2=Eleg l8=1 l9=164	Οὐδεὶσ ἀνθρώπων οὔτ’ ὄλβιοσ οὔτε πενιχρόσ οὔτε κακὸσ νόσφιν δαίμονοσ οὔτ’ ἀγαθόσ.
l0=0002 l1=001 l2=Eleg l8=1 l9=166	Ἄλλ’ ἄλλωι κακόν ἐστι, τὸ δ’ ἀτρεκὲσ ὄλβιοσ οὐδείσ ἀνθρώπων ὁπόσουσ ἠέλιοσ καθορᾶι.
l0=0002 l1=001 l2=Eleg l8=1 l9=168	Ὃν δὲ θεοὶ τιμῶσιν, ὁ καὶ μωμεύμενοσ αἰνεῖ· ἀνδρὸσ δὲ σπουδὴ γίνεται οὐδεμία.
l0=0002 l1=001 l2=Eleg l8=1 l9=170	Θεοῖσ’ εὔχου, θεοῖσ’ οἷσιν ἔπι κράτοσ· οὔτοι ἄτερ θεῶν γίνεται ἀνθρώποισ’ οὔτ’ ἀγάθ’ οὔτε κακά.
l0=0002 l1=001 l2=Eleg l8=1 l9=172	Ἄνδρ’ ἀγαθὸν πενίη πάντων δάμνησι μάλιστα, καὶ γήρωσ πολιοῦ, Κύρνε, καὶ ἠπιάλου.
l0=0002 l1=001 l2=Eleg l8=1 l9=174	ἣν δὴ χρὴ φεύγοντα καὶ ἐσ βαθυκήτεα πόντον ῥιπτεῖν καὶ πετρέων, Κύρνε, κατ’ ἠλιβάτων.
l0=0002 l1=001 l2=Eleg l8=1 l9=176	καὶ γὰρ ἀνὴρ πενίηι δεδμημένοσ οὔτε τι εἰπεῖν οὔθ’ ἕρξαι δύναται, γλῶσσα δέ οἱ δέδεται.
l0=0002 l1=001 l2=Eleg l8=1 l9=178	χρὴ γὰρ ὁμῶσ ἐπὶ γῆν τε καὶ εὐρέα νῶτα θαλάσσησ δίζησθαι χαλεπῆσ, Κύρνε, λύσιν πενίησ.
l0=0002 l1=001 l2=Eleg l8=1 l9=180	τεθνάμεναι, φίλε Κύρνε, πενιχρῶι βέλτερον ἀνδρί ἢ ζώειν χαλεπῆι τειρόμενον πενίηι.
l0=0002 l1=001 l2=Eleg l8=1 l9=182	Κριοὺσ μὲν καὶ ὄνουσ διζήμεθα, Κύρνε, καὶ ἵππουσ εὐγενέασ, καί τισ βούλεται ἐξ ἀγαθῶν βήσεσθαι· γῆμαι δὲ κακὴν κακοῦ οὐ μελεδαίνει ἐσθλὸσ ἀνήρ, ἤν οἱ χρήματα πολλὰ διδῶι, οὐδὲ γυνὴ κακοῦ ἀνδρὸσ ἀναίνεται εἶναι ἄκοιτισ πλουσίου, ἀλλ’ ἀφνεὸν βούλεται ἀντ’ ἀγαθοῦ.
l0=0002 l1=001 l2=Eleg l8=1 l9=188	χρήματα μὲν τιμῶσι· καὶ ἐκ κακοῦ ἐσθλὸσ ἔγημε καὶ κακὸσ ἐξ ἀγαθοῦ· πλοῦτοσ ἔμειξε γένοσ.
l0=0002 l1=001 l2=Eleg l8=1 l9=190	οὕτω μὴ θαύμαζε γένοσ, Πολυπαί̈δη, ἀστῶν μαυροῦσθαι· σὺν γὰρ μίσγεται ἐσθλὰ κακοῖσ.
l0=0002 l1=001 l2=Eleg l8=1 l9=192	Αὐτόσ τοι ταύτην εἰδὼσ κακόπατριν ἐοῦσαν εἰσ οἴκουσ ἄγεται χρήμασι πειθόμενοσ εὔδοξοσ κακόδοξον, ἐπεὶ κρατερή μιν ἀνάγκη ἐντύνει, ἥτ’ ἀνδρὸσ τλήμονα θῆκε νόον.
l0=0002 l1=001 l2=Eleg l8=1 l9=196	Χρῆμα δ’ ὃ μὲν Διόθεν καὶ σὺν δίκηι ἀνδρὶ γένηται καὶ καθαρῶσ, αἰεὶ παρμόνιμον τελέθει.
l0=0002 l1=001 l2=Eleg l8=1 l9=198	εἰ δ’ ἀδίκωσ παρὰ καιρὸν ἀνὴρ φιλοκερδέι θυμῶι κτήσεται, εἴθ’ ὅρκωι πὰρ τὸ δίκαιον ἑλών, αὐτίκα μέν τι φέρειν κέρδοσ δοκεῖ, ἐσ δὲ τελευτήν αὖθισ ἔγεντο κακόν, θεῶν δ’ ὑπερέσχε νόοσ.
l0=0002 l1=001 l2=Eleg l8=1 l9=202	ἀλλὰ τάδ’ ἀνθρώπων ἀπατᾶι νόον· οὐ γὰρ ἔτ’ αὔτωσ τίνονται μάκαρεσ πρήγματοσ ἀμπλακίασ· ἀλλ’ ὁ μὲν αὐτὸσ ἔτεισε κακὸν χρέοσ οὐδὲ φίλοισιν ἄτην ἐξοπίσω παισὶν ἐπεκρέμασεν· ἄλλον δ’ οὐ κατέμαρψε δίκη· θάνατοσ γὰρ ἀναιδήσ πρόσθεν ἐπὶ βλεφάροισ’ ἕζετο κῆρα φέρων.
l0=0002 l1=001 l2=Eleg l8=1 l9=208	Οὐδείσ τοι φεύγοντι φίλοσ καὶ πιστὸσ ἑταῖροσ· τῆσ δὲ φυγῆσ ἐστιν τοῦτ’ ἀνιηρότερον.
l0=0002 l1=001 l2=Eleg l8=1 l9=210	Οἶνόν τοι πίνειν πουλὺν κακόν· ἢν δέ τισ αὐτόν πίνηι ἐπισταμένωσ, οὐ κακόσ, ἀλλ’ ἀγαθόσ.
l0=0002 l1=001 l2=Eleg l8=1 l9=212	Θυμέ, φίλουσ κατὰ πάντασ ἐπίστρεφε ποικίλον ἦθοσ, ὀργὴν συμμίσγων ἥντιν’ ἕκαστοσ ἔχει· πουλύπου ὀργὴν ἴσχε πολυπλόκου, ὃσ ποτὶ πέτρηι, τῆι προσομιλήσηι, τοῖοσ ἰδεῖν ἐφάνη.
l0=0002 l1=001 l2=Eleg l8=1 l9=216	νῦν μὲν τῆιδ’ ἐφέπου, τοτὲ δ’ ἀλλοῖοσ χρόα γίνου.
l0=0002 l1=001 l2=Eleg l8=1 l9=217	κρέσσων τοι σοφίη γίνεται ἀτροπίησ.
l0=0002 l1=001 l2=Eleg l8=1 l9=218	Μηδὲν ἄγαν ἄσχαλλε ταρασσομένων πολιητέων, Κύρνε, μέσην δ’ ἔρχευ τὴν ὁδὸν ὥσπερ ἐγώ.
l0=0002 l1=001 l2=Eleg l8=1 l9=220	Ὅστισ τοι δοκέει τὸν πλησίον ἴδμεναι οὐδέν, ἀλλ’ αὐτὸσ μοῦνοσ ποικίλα δήνε’ ἔχειν, κεῖνόσ γ’ ἄφρων ἐστί, νόου βεβλαμμένοσ ἐσθλοῦ· ἴσωσ γὰρ πάντεσ ποικίλ’ ἐπιστάμεθα· ἀλλ’ ὁ μὲν οὐκ ἐθέλει κακοκερδείηισιν ἕπεσθαι, τῶι δὲ δολοπλοκίαι μᾶλλον ἄπιστοι ἅδον.
l0=0002 l1=001 l2=Eleg l8=1 l9=226	‘Πλούτου δ’ οὐδὲν τέρμα πεφασμένον ἀνθρώποισιν· οἳ γὰρ νῦν ἡμῶν πλεῖστον ἔχουσι βίον, διπλάσιον σπεύδουσι.
l0=0002 l1=001 l2=Eleg l8=1 l9=229	τίσ ἂν κορέσειεν ἅπαντασ;
l0=0002 l1=001 l2=Eleg l8=1 l9=229	χρήματά τοι θνητοῖσ γίνεται ἀφροσύνη, ἄτη δ’ ἐξ αὐτῆσ ἀναφαίνεται, ἣν ὁπότε Ζεύσ πέμψηι τειρομένοισ’, ἄλλοτε ἄλλοσ ἔχει.’
l0=0002 l1=001 l2=Eleg l8=1 l9=232	Ἀκρόπολισ καὶ πύργοσ ἐὼν κενεόφρονι δήμωι, Κύρν’, ὀλίγησ τιμῆσ ἔμμορεν ἐσθλὸσ ἀνήρ.
l0=0002 l1=001 l2=Eleg l8=1 l9=234	Οὐδὲν ἐπιπρέπει ἧμιν ἅτ’ ἀνδράσι σωιζομένοισιν, ἀλλ’ ὡσ πάγχυ πόλει, Κύρνε, ἁλωσομένηι.
l0=0002 l1=001 l2=Eleg l8=1 l9=236	Σοὶ μὲν ἐγὼ πτέρ’ ἔδωκα, σὺν οἷσ’ ἐπ’ ἀπείρονα πόντον πωτήσηι, κατὰ γῆν πᾶσαν ἀειρόμενοσ ῥηϊδίωσ· θοίνηισ δὲ καὶ εἰλαπίνηισι παρέσσηι ἐν πάσαισ πολλῶν κείμενοσ ἐν στόμασιν, καί σε σὺν αὐλίσκοισι λιγυφθόγγοισ νέοι ἄνδρεσ εὐκόσμωσ ἐρατοὶ καλά τε καὶ λιγέα ἄισονται.
l0=0002 l1=001 l2=Eleg l8=1 l9=243	καὶ ὅταν δνοφερῆσ ὑπὸ κεύθεσι γαίησ βῆισ πολυκωκύτουσ εἰσ Ἀίδαο δόμουσ, οὐδέποτ’ οὐδὲ θανὼν ἀπολεῖσ κλέοσ, ἀλλὰ μελήσεισ ἄφθιτον ἀνθρώποισ’ αἰὲν ἔχων ὄνομα, Κύρνε, καθ’ Ἑλλάδα γῆν στρωφώμενοσ, ἠδ’ ἀνὰ νήσουσ ἰχθυόεντα περῶν πόντον ἐπ’ ἀτρύγετον, οὐχ ἵππων νώτοισιν ἐφήμενοσ· ἀλλά σε πέμψει ἀγλαὰ Μουσάων δῶρα ἰοστεφάνων.
l0=0002 l1=001 l2=Eleg l8=1 l9=250	πᾶσι δ’, ὅσοισι μέμηλε, καὶ ἐσσομένοισιν ἀοιδή ἔσσηι ὁμῶσ, ὄφρ’ ἂν γῆ τε καὶ ἠέλιοσ.
l0=0002 l1=001 l2=Eleg l8=1 l9=252	αὐτὰρ ἐγὼν ὀλίγησ παρὰ σεῦ οὐ τυγχάνω αἰδοῦσ, ἀλλ’ ὥσπερ μικρὸν παῖδα λόγοισ μ’ ἀπατᾶισ.
l0=0002 l1=001 l2=Eleg l8=1 l9=254	Κάλλιστον τὸ δικαιότατον· λῶιστον δ’ ὑγιαίνειν· πρᾶγμα δὲ τερπνότατον, τοῦ τισ ἐρᾶι, τὸ τυχεῖν.
l0=0002 l1=001 l2=Eleg l8=1 l9=256	Ἵπποσ ἐγὼ καλὴ καὶ ἀεθλίη, ἀλλὰ κάκιστον ἄνδρα φέρω, καί μοι τοῦτ’ ἀνιηρότατον.
l0=0002 l1=001 l2=Eleg l8=1 l9=258	πολλάκι δ’ ἠμέλλησα διαρρήξασα χαλινόν φεύγεν ἀπωσαμένη τὸν κακὸν ἡνίοχον.
l0=0002 l1=001 l2=Eleg l8=1 l9=260	Οὔ μοι πίνεται οἶνοσ, ἐπεὶ παρὰ παιδὶ τερείνηι ἄλλοσ ἀνὴρ κατέχει πολλὸν ἐμοῦ κακίων.
l0=0002 l1=001 l2=Eleg l8=1 l9=262	ψυχρόν μοι παρὰ τῆιδε φίλοι πίνουσι τοκῆεσ, ὥσθ’ ἅμα θ’ ὑδρεύει καί με γοῶσα φέρει, ἔνθα μέσην περὶ παῖδα λαβὼν ἀγκῶν’ ἐφίλησα δειρήν, ἡ δὲ τέρεν φθέγγετ’ ἀπὸ στόματοσ.
l0=0002 l1=001 l2=Eleg l8=1 l9=266	Γνωτή τοι πενίη γε καὶ ἀλλοτρίη περ ἐοῦσα· οὔτε γὰρ εἰσ ἀγορὴν ἔρχεται οὔτε δίκασ· πάντηι γὰρ τοὔλασσον ἔχει, πάντηι δ’ ἐπίμυκτοσ, πάντηι δ’ ἐχθρὴ ὁμῶσ γίνεται, ἔνθα περ ἦι.
